<?xml version="1.0" encoding="UTF-8"?>
<xs:schema xmlns:xs="http://www.w3.org/2001/XMLSchema" targetNamespace="http://example.com">

    <xs:element name="class">
        <xs:complexType>
            <xs:sequence>
                <xs:element name="student" minOccurs="1" maxOccurs="unbounded">
                    <xs:complexType>
                        <xs:sequence>
                            <xs:element name="name" type="xs:string" />
                            <xs:element name="id" type="xs:string" />
                            <xs:element name="branch">
                                <xs:complexType>
                                    <xs:sequence>
                                        <xs:element name="specialization" type="xs:string"
                                            minOccurs="1" maxOccurs="3" />
                                    </xs:sequence>
                                </xs:complexType>
                            </xs:element>
                            <xs:element name="cgpa" type="xs:decimal" />

                        </xs:sequence>
                    </xs:complexType>
                </xs:element>
            </xs:sequence>
        </xs:complexType>
    </xs:element>

</xs:schema>